{
  "specVersion": "1",
  "id": "@securitytest/ui-v1-with-js",
  "publisher": "securitytest",
  "version": "0.0.1",
  "displayName": "UI v1 with JS (must be rejected)",
  "license": "UNLICENSED",
  "engines": { "oxp": "^1.0.0" },
  "main": { "ui": "tree.json" },
  "ui": { "components": "oxp-ui-v1" }
}
