{
  "specVersion": "1",
  "id": "@securitytest/shell-from-unverified",
  "publisher": "securitytest",
  "version": "0.0.1",
  "displayName": "terminal.shell from unverified publisher (must be rejected)",
  "license": "UNLICENSED",
  "engines": { "oxp": "^1.0.0" },
  "main": { "ui": "tree.json" },
  "ui": { "components": "oxp-ui-v1" },
  "permissions": [
    { "id": "terminal.shell", "rationale": "i promise this is fine" }
  ]
}
