{
  "specVersion": "1",
  "id": "@__PUBLISHER__/__SLUG__",
  "publisher": "__PUBLISHER__",
  "version": "0.0.1",
  "displayName": "__DISPLAY_NAME__",
  "description": "OXP V1 component tree (Piye-native ready).",
  "license": "MIT",
  "categories": ["other"],
  "engines": { "oxp": "^1.0.0" },
  "icon": "icon.png",
  "main": { "ui": "ui/tree.json" },
  "ui": { "components": "oxp-ui-v1", "preferredSurface": "panel" },
  "permissions": []
}
