{
  "specVersion": "1",
  "id": "@aldgar/hello-rust",
  "publisher": "aldgar",
  "version": "0.1.0",
  "displayName": "Hello (Rust)",
  "description": "OXP component-v1 extension written in Rust. Greets the host.",
  "license": "MIT",
  "categories": ["other"],
  "engines": { "oxp": "^1.0.0" },
  "kind": "component-v1",
  "main": { "wasm": "build/hello_rust.wasm" },
  "permissions": [],
  "wit": {
    "package": "oxp:extension",
    "version": "0.1.0",
    "sha256": "97f1ff62b3d3cb997b52921aca090a9da3ca8d1827dcf5f183a831321e454daf"
  }
}
