{
  "specVersion": "1",
  "id": "@aldgar/review-ext",
  "publisher": "aldgar",
  "version": "0.0.1",
  "displayName": "Review Ext",
  "description": "Hello, OXP world.",
  "license": "MIT",
  "categories": ["other"],
  "engines": { "oxp": "^1.0.0" },
  "main": { "ui": "ui/index.html" },
  "ui": { "components": "oxp-ui-only", "preferredSurface": "panel" },
  "permissions": []
}
