{
  "specVersion": "1",
  "id": "@__PUBLISHER__/__SLUG__",
  "publisher": "__PUBLISHER__",
  "version": "0.0.1",
  "displayName": "__DISPLAY_NAME__",
  "description": "Hello, OXP world.",
  "license": "MIT",
  "categories": ["other"],
  "engines": { "oxp": "^1.0.0" },
  "main": { "ui": "ui/index.html" },
  "ui": { "components": "oxp-ui-only", "preferredSurface": "panel" },
  "permissions": []
}
